title,author,year,type,keywords,cluster
Lampada Tolomeo,"DE LUCCHI, MICHELE",1989,07.13 Progetti,-,nocluster
"Design for Assembly,","BRUNO, DAVIDE MARIA",1993,07.12 Altro,"Robust design design a basso impatto ambientale. Processi, assemblaggi e disassemblaggi dei prodotti industriali.",nocluster
Il cadenzamento dell’orario ferroviario: aspetti metodologici e applicativi,"MAJA, ROBERTO;LIMONGELLI M.;VILLA S.",1994,07.12 Altro,-,nocluster
"Il quadro dell'offerta di trasporto, IReR - Istituto Regionale di Ricerca della Lombardia - Aggiornamento del piano regionale dei trasporti della regione Lombardia","COMETTI E.;MAJA, ROBERTO",1995,07.12 Altro,-,nocluster
Telematica nei trasporti - Stato dell'arte delle tecnologie per il trasporto guidato e per l'intermodalità,"MAJA, ROBERTO;GUERRA C.;CORTESE V.",1995,07.12 Altro,-,nocluster
Sistemi innovativi per l'esercizio economico delle linee ferroviarie a scarso traffico,"MAJA, ROBERTO",1995,07.12 Altro,-,nocluster
Studio di simulazione del trasporto pubblico nel bacino della ferrovia Brescia-Iseo-Edolo,"MAJA, ROBERTO",1995,07.12 Altro,-,nocluster
Esposizione: IPOTESI ECOMUSEALE PER I CAMPI FLEGREI,"PARENTE, MARINA;V. Gangemi",1996,07.05 Esposizione,-,nocluster
Mostra: IL DESIGN COME ELEMENTO STRATEGICO PER LE PICCOLE E MEDIE IMPRESE. PROPOSTE E PROGETTI DELLA SCUOLA DI SPECIALIZZAZIONE IN DISEGNO INDUSTRIALE DI NAPOLI,"PARENTE, MARINA;E. Guida;R. Valente",1996,07.06 Mostra,-,nocluster
Catalogo dei sistemi innovativi di navetta automatica per la mobilità urbana,"MAJA, ROBERTO;GUERRA C.",1996,07.12 Altro,-,nocluster
PROGETTO E INDUSTRIA,"PARENTE, MARINA;E. Guida;R. Valente",1997,07.06 Mostra,-,nocluster
Consulenza e collaborazione per la sperimentazione di modelli di simulazione della mobilità a supporto della pianificazione regionale dei trasporti e della mobilità - Caso di studio Malpensa - Costruzione del modello di simulazione del traffico per la valutazione degli scenari alternativi,"MAJA, ROBERTO;DALENO M.",1997,07.12 Altro,-,nocluster
Mostra: SOTTSSAS. 151 DISEGNI,"V. Cristallo;GUIDA, FRANCESCO ERMANNO;M. Elia;A. Morone;PARENTE, MARINA",1998,07.06 Mostra,-,nocluster
IV MOSTRA DELL’ARTIGIANATO ARTISTICO - CONTINUITA’ E INNOVAZIONE DELLA TRADIZIONE,"V. Cristallo;E. Guida;A. Morone;PARENTE, MARINA",1998,07.06 Mostra,-,nocluster
Disabilità Motoria e Lavoro: guida per orientarsi nel mondo del lavoro Vol 1 e 2,"A.A. V.V.;CANINA, MARIA RITA",1999,07.12 Altro,-,nocluster
Concorso internazionale “Sarajevo Concert Hall” Nuovo auditorium di Sarajevo,"E. Avallone;L. Montuori;S. Orsi;PIERLUISI, GABRIELE;A. Sciolari",1999,07.13 Progetti,-,nocluster
La domotica: qualità degli ambienti in AAVV Disabilità Motoria e Lavoro: contributi per un agire interdisciplinare,"A.A. VV;CANINA, MARIA RITA",2000,07.12 Altro,-,nocluster
Comunicazione (visiva) domani. Sperimentazione e nuovi confini,"GUIDA, FRANCESCO ERMANNO",2000,07.12 Altro,-,nocluster
Lionello Balestrieri e le esposizioni,"MAZZANTI, ANNA",2000,07.12 Altro,tardoromanticismo di fine XIX sec; futurismo; ritorno all'ordine figurativo,nocluster
“Sentieri nell’arte”. Arte ambientale in Toscana,"MAZZANTI, ANNA",2000,07.12 Altro,arte ambientata; arte ambientale; scultura in spazi aperti,nocluster
Concorso internazionale in due fasi “Ampliamento della Galleria Comunale d'Arte Moderna e Contemporanea. Ex-Fabbrica Peroni” a Roma.,"E. Avallone;L. Montuori;R. Petrachi;S. Orsi;PIERLUISI, GABRIELE;A. Sciolari",2000,07.13 Progetti,-,nocluster
Gamba “intelligente” cambia il passo secondo il terreno,"CANINA, MARIA RITA;GENNARO VERNI;PIERLUIGI VALENTINI",2001,07.12 Altro,-,nocluster
Stampante Ink Jet Artjet 10 (XP 30),"DE LUCCHI, MICHELE",2001,07.13 Progetti,-,nocluster
"Concorso Internazionale Europan 6, “Urbanità europea e progetti strategici”, Sito di Massa, Italia.","E. Avallone;L. Montuori;M. Musmeci;R. Petrachi;S. Orsi;PIERLUISI, GABRIELE;A. Sciolari",2001,07.13 Progetti,-,nocluster
Concorso internazionale di progettazione “Tre Parcheggi di scambio” Roma Nuovo Salario.,"E. Avallone;M. Fegiz;F. Galdo;M. Musmeci;S. Orsi;PIERLUISI, GABRIELE;A. Sciolari",2001,07.13 Progetti,-,nocluster
"Blue Industries: Dove nasce il futuro: design, innovazione e impresa",davide bruno,2002,07.03 Design,-,nocluster
DILABB,"GALBIATI, MARIA LUISA;FRANCESCO GALLI",2002,07.12 Altro,-,nocluster
I grandi progetti infrastrutturali: divergenze sui criteri di valutazione,"PONTI, MARCO GUIDO;A. Boitani",2002,07.12 Altro,-,nocluster
La lezione del ponte sullo Stretto,"PONTI, MARCO GUIDO;A. Boitani",2002,07.12 Altro,-,nocluster
Il federalismo stradale: Procedure e prime applicazioni legislative.,"C. Borgnolo;PONTI, MARCO GUIDO;TORTA, FABIO PIETRO",2002,07.12 Altro,-,nocluster
"Nuove tecnologie, multimedia e standard grafici per la rappresentazione digitale del territorio","CECONELLO, MAURO ATTILIO",2002,07.12 Altro,-,nocluster
Contratto di quartiere San Giuseppe Baia del Re di Piacenza. Il controllo di qualità e la flessibilità nel progetto di riqualificazione,"SCHIAFFONATI, FABRIZIO;SCOCCIMARRO, ANTONIO;FANZINI, DANIELE;BIANCHI, CRISTINA;CAVALLERI, ANNA;COLLINA, LUISA MARIA VIRGINIA;M. Corò;DAGLIO, LAURA;FANTINI, ADRIANA;GINELLI, ELISABETTA;MUSSINELLI, ELENA GERMANA;M. Sancito;VITOLA, FRANCESCO",2002,07.13 Progetti,Contratto di quartiere; Edilizia residenziale pubblica; Sistemi di qualità,nocluster
Concorso internazionale ad inviti per la realizzazione del “Museo dell'audiovisivo nel Palazzo della Civiltà del Lavoro all' EUR” Roma,"E. Avallone;CARBONARA, GIANNI;G. Colucci;M. Fegiz;F. Galdo;M. Musmeci;S. Orsi;PIERLUISI, GABRIELE;M. sasso;A. Sciolari",2002,07.13 Progetti,-,nocluster
Proceedings of the 8th International Conference on Human Aspects of Advanced Manifacturing: Agility & Hybrid Automation,"BAGNARA, SEBASTIANO;S. Pozzi;A. Rizzo;RIZZO, FRANCESCA;S. Save",2003,07.12 Altro,-,nocluster
Il tempo ai tempi di internet,"GUIDA, FRANCESCO ERMANNO",2003,07.12 Altro,-,nocluster
Ma che strani tipi,"GUIDA, FRANCESCO ERMANNO",2003,07.12 Altro,-,nocluster
Alitalia: un'Italia senza ali,"PONTI, MARCO GUIDO",2003,07.12 Altro,-,nocluster
La leggenda del corridoio Lisbona - Kiev,"PONTI, MARCO GUIDO",2003,07.12 Altro,-,nocluster
Allestimento degli interni e grafica del Neues Museum Berlino,"DE LUCCHI, MICHELE",2003,07.13 Progetti,-,nocluster
"Concorso Internazionale Europan 7: “periferia-IN” sito di Bageria (PA), Italia","E. Avallone;M. De Angelis;G. Forte;S. Orsi;PIERLUISI, GABRIELE;A. Sciolari",2003,07.13 Progetti,-,nocluster
"Concorso internazionale di progettazione in due fasi “Mille idee per un concorso” per la costruzione della nuova sede dell'Istituto Zooprofilattico Sperimentale dell'Abruzzo e del Molise, Teramo.","E. Avallone;M. Cocciolito;F. Galdo;G. Lupoi;M. Musmeci;S. Orsi;PIERLUISI, GABRIELE;A. Sciolari",2003,07.13 Progetti,-,nocluster
Nuova Sede del Consiglio Regionale,"P. Portoghesi;BLASI, CESARE;PADOVANO, GABRIELLA;NEBULONI, ATTILIO;M. Ruscelli",2003,07.13 Progetti,-,nocluster
"Centro Europeo per le Creatività Emergenti - concorso internazionale ""ex Tabacchificio Centola""","BLASI, CESARE;NEBULONI, ATTILIO;PADOVANO, GABRIELLA",2003,07.13 Progetti,-,nocluster
LE PROFESSIONI DELLA TELEVISIONE-LEZIONE MULTIMEDIALE IN RAI,"GALBIATI, MARIA LUISA;GALLI FRANCESCO",2004,07.12 Altro,-,nocluster
GRUPPO CIMBALI-FAEMA. DVD ISTITUZIONALE,"GALBIATI, MARIA LUISA;FRANCESCO GALLI",2004,07.12 Altro,-,nocluster
Studio di fattibilità per una metrotranvia in Como,"COLORNI VITALE, ALBERTO;D. CICCARELLI;A. LUE';D. ROSSI",2004,07.12 Altro,-,nocluster
Il Sistema DREAMS: Demand Responsive Extended Area Mobility Services,"COLORNI VITALE, ALBERTO;D. CICCARELLI;A. LUE';V. MORROCCHI;D. ROSSI",2004,07.12 Altro,-,nocluster
Sistema di identità visiva di Palazzo dei Pio a Carpi,"GUIDA, FRANCESCO ERMANNO",2004,07.13 Progetti,-,nocluster
Piano di marketing territoriale per l’area dell’Oltrepò Mantovano,"SCHIAFFONATI, FABRIZIO;STEVAN, CESARE ANTONIO;MUSSINELLI, ELENA GERMANA;CASONI, GIORGIO;CELASCHI, FLAVIANO;FANZINI, DANIELE;TROCCHIANESI, RAFFAELLA",2004,07.13 Progetti,Marketing territoriale; Valorizzazione del capitale territoriale; Turismo; Comunicazione,nocluster
Concorso di idee per un centro socio-ricreativo da realizzare sull’area pubblica denominata Nava,"NEBULONI, ATTILIO;R. Bosia;T. Bosia;M. Besseghini;R. Malvestiti",2004,07.13 Progetti,-,nocluster
Picasso. La seduzione del classico,"GADDI, ROSSANA;MARIANI, CIRO",2005,07.03 Design,-,nocluster
MANTEROMOOD.DVD MULTIMEDIALE,"GALBIATI, MARIA LUISA;FRANCESCO GALLI",2005,07.12 Altro,-,nocluster
Le tecnologie dell’informazione e della comunicazione e lo sviluppo locale,"MANZINI, EZIO;RIZZO, FRANCESCA",2005,07.12 Altro,-,nocluster
Biblioteca di Storia dell'Arte e restauro della Manica Lunga,"DE LUCCHI, MICHELE",2005,07.13 Progetti,-,nocluster
Sistema per ufficio MDL,"DE LUCCHI, MICHELE",2005,07.13 Progetti,design; ufficio,nocluster
"Concorso Internazionale Europan 8, “Urbanità europea e progetti strategici”, sito di Antalya, Turchia","E. Avallone;G. Forte;PIERLUISI, GABRIELE",2005,07.13 Progetti,-,nocluster
René Magritte. L'impero delle luci,"GADDI, ROSSANA;MARIANI, CIRO",2006,07.03 Design,-,nocluster
New Italian Design,"BRANZI, ANDREA;BIAMONTI, ALESSANDRO;Macchi D.",2006,07.05 Esposizione,Design italiano; Design; Allestimenti; Interni,nocluster
Texture & Materials – Urban Light Walk,"GEROSA, GIULIA MARIA",2006,07.06 Mostra,-,nocluster
Puntare sulla gente per vendere di più,"ZURLO, FRANCESCO",2006,07.12 Altro,-,nocluster
New Entertainment e Design Strategico,"ZURLO, FRANCESCO",2006,07.12 Altro,-,nocluster
A.D.A. Archivio Digitale di Architettura,"R. MINGUCCI;AMORUSO, GIUSEPPE;R. INGLESE;A. MARATA;G. BACCI;C. BARTOLOMEI;D. ANGELILLO",2006,07.12 Altro,-,nocluster
Moda e Design: Cross Fertilization per l'innovazione,"CONTI, GIOVANNI MARIA;BERTOLA, PAOLA",2006,07.12 Altro,-,nocluster
Fit-Suit: Biodesign per l’idrokinesiterapia,"CANINA, MARIA RITA;FERRARO, VENERE",2006,07.12 Altro,-,nocluster
Il trasporto delle merci pericolose in galleria,"MAJA, ROBERTO;RAINOLDI, GIOVANNI;ROMAN D;SALIMBENI R.",2006,07.12 Altro,-,nocluster
External Cost Assessment In Transalpine Corridors,"MAJA, ROBERTO;D. ROMANO'",2006,07.12 Altro,-,nocluster
European Logo Design Award (EULDA 06),"GUIDA, FRANCESCO ERMANNO",2006,07.13 Progetti,-,nocluster
Award of Excellence «Communication Arts» (Usa),"GUIDA, FRANCESCO ERMANNO",2006,07.13 Progetti,-,nocluster
"Concorso di Progettazione, Project Financing, Metro D Roma, Fermate Ojetti e Pugliese e Nuovo Salario.","Mandataria Società Italiana per le Condotte D'acqua;Mandante Impresa Pizzarotti;C.;Responsabile del progetto Geodeta S. p. a.;G. Fioravanti;F. Galdo;PIERLUISI, GABRIELE",2006,07.13 Progetti,-,nocluster
"Gli impressionisti, i simbolisti e le avanguardie. 120 capolavori dal museo nazionale di Belgrado.","GADDI, ROSSANA",2007,07.03 Design,-,nocluster
Transforme,"CONTI, GIOVANNI MARIA;Bonapace D.;Botta F.;Burani S.",2007,07.05 Esposizione,-,nocluster
"Mostra e giornata di studio: ""Lo Studio-Museo Achille Castiglioni della Triennale di Milano. Scenari di fruizione e prospettive di valorizzazione"" presso la Triennale di Milano - settembre 2007","S. Annicchiarico;PARENTE, MARINA;SEASSARO, ALBERTO",2007,07.06 Mostra,Studio Museo Achille Castiglioni; Triennale di Milano; ricerca d.cult; design per i beni culturali,nocluster
Ernst von Glasersfeld and the Italian Operative School,"PIZZOCARO, SILVIA LUISA;R. Glanville",2007,07.12 Altro,Ricerca operativa,nocluster
La ricerca del piacere,"GUIDA, FRANCESCO ERMANNO",2007,07.12 Altro,-,nocluster
"Gabriele Pierluisi. Paesaggi urbani. Marte, Roma 2007-08","Massimiliano Fuksas;Camilla Pignatti Morano;Marta Fegiz;Laura De Iudicibus;PIERLUISI, GABRIELE",2007,07.12 Altro,Paesaggio urbano; MARTE; Digitale Caldo; Pittura e disegno; Pieghe; spazio.,nocluster
"Concorso Internazionale di progettazione a Procedura ristretta  “MENO È PIÙ 2”, Servizi e spazi pubblici in Roma nei Programmi di Trasformazione Urbanistica. Tor Marancia Area del Divino Amore.","E. Avallone;G. Forte;M. Musmeci;S. Orsi;PIERLUISI, GABRIELE;A. Sciolari",2007,07.13 Progetti,-,nocluster
"L'abbraccio di Vienna. Klimt, Schiele e i capolavori del Belvedere","GADDI, ROSSANA",2008,07.03 Design,-,nocluster
"Case rapide, prefabbricate, smontabili","FERABOLI, MARIA TERESA",2008,07.05 Esposizione,-,nocluster
"Mostra: Studio Museo Achille Castiglioni, presso Shiodome Italia Creative Center, Tokyo","S. Annicchiarico;PARENTE, MARINA;SEASSARO, ALBERTO",2008,07.06 Mostra,Studio Museo Achille Castiglioni; ricerca d.cult; Triennale di Miano; design per i beni culturali,nocluster
"""FABIO NOVEMBRE. Insegna anche a me la libertà delle rondini"".","FINESSI, GIUSEPPE",2008,07.06 Mostra,-,nocluster
Una grande opera. Tutta da valutare,"PONTI, MARCO GUIDO;BERIA, PAOLO",2008,07.12 Altro,-,nocluster
L’evoluzione dei Musei con l’Information and Communication Technology,"CANINA, MARIA RITA;I. Celino;E. Frumento;A. Pagani;N. Simeoni",2008,07.12 Altro,-,nocluster
Enografie. Il design racconta i vini del Piemonte.,"BAULE, GIOVANNI;BUCCHETTI, VALERIA LUISA",2008,07.12 Altro,-,nocluster
Interazioni grafico-strutturali,"BUCCHETTI, VALERIA LUISA",2008,07.12 Altro,-,nocluster
Superfici (tra vista e tatto),"BUCCHETTI, VALERIA LUISA",2008,07.12 Altro,-,nocluster
Ottimizzazione della raccolta dei Rifiuti di Apparecchiature Elettriche ed Elettroniche (RAEE),"BRUGLIERI, MAURIZIO;CATTANEO, FABIANO;COLOMBO, ANDREA;COLORNI VITALE, ALBERTO",2008,07.12 Altro,-,nocluster
Enografie: il design dei percorsi narrativi,"BAULE, GIOVANNI",2008,07.12 Altro,-,nocluster
Il futuro dell’e-learning è già passato,"COLORNI VITALE, ALBERTO;SANCASSANI, SUSANNA;L. Leita",2008,07.12 Altro,-,nocluster
"Benefits and problems of e-learning, UE Committee on Culture Science and Education, Realising the full potential of e-learning at all levels of education.","COLORNI VITALE, ALBERTO",2008,07.12 Altro,-,nocluster
A passo lento nel tunnel,"GRIMALDI, RAFFAELE;PONTI, MARCO GUIDO",2008,07.12 Altro,-,nocluster
E sulla Milano-Venezia i conti non tornano,"GRIMALDI, RAFFAELE;PONTI, MARCO GUIDO",2008,07.12 Altro,-,nocluster
piattaforma LeNS,"VEZZOLI, CARLO ARNALDO",2008,07.12 Altro,-,nocluster
Leggere il contesto per orientare il progetto. Metodologie e approcci per la produzione e visualizzazione di conoscenza ad orientamento della pratica progettuale nel design della moda.,"COLOMBI, CHIARA",2008,07.12 Altro,-,nocluster
Occasioni di complessità sostenibile / Opportunities of sustainable complexity - Complessità e sostenibilià: il territorio e l'architettura n. 05,"PADOVANO, GABRIELLA;BLASI, CESARE;NEBULONI, ATTILIO;I. Anastasio;V. Arrigoni",2008,07.12 Altro,-,nocluster
Gli spazi della complessità / The spaces of complexity - Complessità e sostenibilià: il territorio e l'architettura n. 06,"PADOVANO, GABRIELLA;BLASI, CESARE;NEBULONI, ATTILIO;I. Anastasio;V. Arrigoni",2008,07.12 Altro,-,nocluster
Tendenze della ricerca universitaria - Complessità e sostenibilià: il territorio e l'architettura n. 07,"PADOVANO, GABRIELLA;BLASI, CESARE;NEBULONI, ATTILIO;I. Anastasio;V. Arrigoni",2008,07.12 Altro,-,nocluster
Oltre l'architettura convenzionale / Beyond conventional architecture - Complessità e sostenibilià: il territorio e l'architettura n. 08,"PADOVANO, GABRIELLA;BLASI, CESARE;NEBULONI, ATTILIO;I. Anastasio;V. Arrigoni",2008,07.12 Altro,-,nocluster
Nuovi spazi interattivi / New interactive spaces - Complessità e sostenibilià: il territorio e l'architettura n. 09,"PADOVANO, GABRIELLA;BLASI, CESARE;NEBULONI, ATTILIO;I. Anastasio;V. Arrigoni",2008,07.12 Altro,-,nocluster
Progettazione della comunicazione visiva e degli apparati comunicativi per il Museo Nazionale Archeologico di Taranto,"GUIDA, FRANCESCO ERMANNO;Carla De Luca;Giovanni Dema;Nicola Scotto di Carlo;Jaana Zammer",2008,07.13 Progetti,Identità visiva; segnaletica informativa e di orientamento; sito web,nocluster
Ponte di accesso al Triennale Design Museum,"DE LUCCHI, MICHELE",2008,07.13 Progetti,-,nocluster
Concorso Internazionale di Progettazione a Grado Unico Ristretto: “Amamontagnola” Roma.,"E. Avallone;G. Forte;M. Musmeci;S. Orsi;PIERLUISI, GABRIELE;A. Sciolari",2008,07.13 Progetti,-,nocluster
Time To Design,"GEROSA, GIULIA MARIA;M. Berghinz",2009,07.06 Mostra,-,nocluster
Opening Soon,"GEROSA, GIULIA MARIA;COLLINA, LUISA MARIA VIRGINIA;BRANZI, ANDREA",2009,07.06 Mostra,-,nocluster
PAOLO ULIAN 1990-2009,"FINESSI, GIUSEPPE",2009,07.06 Mostra,-,nocluster
ANGELO MANGIAROTTI SCOLPIRE/COSTRUIRE,"FINESSI, GIUSEPPE",2009,07.06 Mostra,-,nocluster
ALESSANDRO MENDINI,"FINESSI, GIUSEPPE",2009,07.06 Mostra,-,nocluster
PIO MANZU'. Quando il mondo era moderno.,"Giacinto Di Pietrantonio;Enrico Leonardo Fagone;FINESSI, GIUSEPPE",2009,07.06 Mostra,-,nocluster
Propsettive di design per i servizi Mobile secondo l'approccio User Centred,"PILLAN, MARGHERITA;RIZZO, FRANCESCA",2009,07.12 Altro,-,nocluster
Design Per. L'ambiente,"GUIDA, FRANCESCO ERMANNO;Chia G.",2009,07.12 Altro,-,nocluster
The Identity of Cultural Heritages between Real and Virtual. New Languages and Virtuous Devices in the Age of Transition.,"GUIDA, FRANCESCO ERMANNO",2009,07.12 Altro,-,nocluster
Freesbe: Free sound diffusion,"MAURI, MICHELE;Desiato, Andrea;Paolo, Dusi;Napoli, Mauro",2009,07.13 Progetti,-,nocluster
Citymurmur,"QUAGGIOTTO, MARCO;CAVIGLIA, GIORGIO;GRAFFIETI, MICHELE;S. Granados Lopez;D. Guido;RICCI, DONATO;SCAGNETTI, GAIA",2009,07.13 Progetti,Media; news; city; cartography; mapping; communication design; urban space,nocluster
DRM - Design Research Maps,"BERTOLA, PAOLA;MAFFEI, STEFANO;BIANCHINI, MASSIMO;VILLARI, BEATRICE",2009,07.13 Progetti,Design Research; Maps; Academic Design Research,nocluster
"Il Ponte della Pace, Tbilisi (Georgia)","DE LUCCHI, MICHELE",2009,07.13 Progetti,-,nocluster
Mediterranean Design. Tra presente e futuro,"FERRARA, MARIA RITA;C. Ferrara",2009,07.13 Progetti,Design; Mediterraneo; visul design; product design; fotografia; designer,nocluster
Rubens e i fiamminghi,"GADDI, ROSSANA",2010,07.03 Design,-,nocluster
BiNOMi – Biennale Nord Ovest Milano,"GEROSA, GIULIA MARIA",2010,07.06 Mostra,-,nocluster
GIOVANNI LEVANTI,"FINESSI, GIUSEPPE",2010,07.06 Mostra,-,nocluster
Nel tunnel dell'Alta Velocità,"BERIA, PAOLO;GRIMALDI, RAFFAELE;PONTI, MARCO GUIDO",2010,07.12 Altro,alta velocità; ferrovie; analisi costi benefici; ex-post,nocluster
L'impatto delgi ITS per la riduzione di CO2,"STUDER, LUCA PASINO;V. Mauro",2010,07.12 Altro,-,nocluster
Italian Light Contract,"TURINETTO, MARCO",2010,07.12 Altro,-,nocluster
Choosing between ecology awareness and business,"TURINETTO, MARCO",2010,07.12 Altro,-,nocluster
Light for a new product identity,"TURINETTO, MARCO",2010,07.12 Altro,-,nocluster
"Lighting ethics, enviroment","TURINETTO, MARCO",2010,07.12 Altro,-,nocluster
"Individualised Consumption: is the future industry ready for a complex, higly-differentiated market ?","TURINETTO, MARCO",2010,07.12 Altro,-,nocluster
On living well in today's enviroments,"TURINETTO, MARCO",2010,07.12 Altro,-,nocluster
A Moda projectada,"COLOMBI, CHIARA",2010,07.12 Altro,-,nocluster
100 virtuous cities,"PICCINNO, GIOVANNA;LEGA, ELISA;FASSI, DAVIDE",2010,07.13 Progetti,-,nocluster
100 virtuous cities,"PICCINNO, GIOVANNA;LEGA, ELISA;FASSI, DAVIDE",2010,07.13 Progetti,-,nocluster
Parquet Medoc,"DE LUCCHI, MICHELE",2010,07.13 Progetti,product design,nocluster
Il progetto illuminotecnico per la Mostra di Hopper a Roma,"MURANO, FRANCESCO",2010,07.13 Progetti,Illuminotecnica; Illuminazione Opere d'Arte; Edward Hopper,nocluster
"CONCORSO D’IDEE
PER LA PROGETTAZIONE DI PIAZZA XX SETTEMBRE E DEGLI SPAZI ANNESSI","GEROSA, GIULIA MARIA;D. Fumagalli;G. Lassandro;D. Prinzo",2010,07.13 Progetti,-,nocluster
Concorso di idee finalizzato all’acquisizione di una proposta ideativa in merito alla riqualificazione della piazza Sennorigau in Villagrande Strisaili,"GEROSA, GIULIA MARIA;G. LAssandro;D. Fumagalli;D. Prinzo",2010,07.13 Progetti,-,nocluster
Boldini e la Belle Epoque,"GADDI, ROSSANA",2011,07.03 Design,-,nocluster
Autoproduzioni Italiane,"MAFFEI, STEFANO;GIANNI, ANDREA ENRICO;BOLZAN, PATRIZIA",2011,07.06 Mostra,-,nocluster
DI VASO IN FIORE,"FINESSI, GIUSEPPE",2011,07.06 Mostra,-,nocluster
L’unità d’Italia: testimonianze risorgimentalinei musei e nel territorio della Toscana,"MAZZANTI, ANNA",2011,07.12 Altro,unità; risorgimento; arte,nocluster
"Arena Models. Deliverable 2.1 for Periheria project, Grant Agreement number: 271015","CONCILIO, GRAZIA;RIZZO, FRANCESCA",2011,07.12 Altro,-,nocluster
Deliverable 2.1: Scenarios description. Deliverable for the European Project Life 2.0 LIFE 2.0Geographical positioning services to support independent living and social interaction of elderly people ICT-PSP-270965,"RIZZO, FRANCESCA;COSTA, FIAMMETTA CARLA ENRICA;Oliva S.",2011,07.12 Altro,-,nocluster
Esposizione personale: PARIS_PLIS  Gabriele Pierluisi a cura di Martina Cavallarin.  Parigi dal 03-02-2011 al 03-03-2011,"PIERLUISI, GABRIELE",2011,07.12 Altro,città; paesaggio urbano; design; paesaggio; pittura; pittura digitale; spazio; 3D e 2D.,nocluster
Good Idea + Good Design = Good Service ? Learning how to evaluate Service Design,"MAFFEI, STEFANO;E. Pacenti;VILLARI, BEATRICE",2011,07.12 Altro,-,nocluster
Natural Fashion. From symbolic to cognitive innovation through crafts and design,"COLOMBI, CHIARA",2011,07.12 Altro,-,nocluster
"Brevetto, Design e ""forma del tempo"". I brevetti nella storia del design italiano","BOSONI, GIAMPIERO",2011,07.12 Altro,-,nocluster
Dust: A Visualization Tool Supporting Parents’ School-Choice Evaluation Process,"AZZI, MATTEO;CAVIGLIA, GIORGIO;RICCI, DONATO;CIUCCARELLI, PAOLO;Emanuele Bonetti;Loredana Bontempi",2011,07.12 Altro,cartography; Data visualization; Decision Support Systems; Open Data,nocluster
NUTRIRE MILANO. Seconda annualità del progetto - Relazione al bilancio.,"MERONI, ANNA;SIMEONE, GIULIA;CORUBOLO, MARTA;D. Cantu;PIREDDA, FRANCESCA;A. Arossa;P. Bolzacchini;A. Cecchini;E. Nasuelli",2011,07.12 Altro,Service Design; Strategic Design; Sustainable development,nocluster
Smart Citizens community directory. Deliverable 3.1.1 Progetto europeo Peripheria,"CONCILIO, GRAZIA;RIZZO, FRANCESCA;e.t. alii",2011,07.12 Altro,-,nocluster
Sociable Housing,"MERONI, ANNA;FERRI, GIORDANA",2011,07.12 Altro,Service Design,nocluster
"Per l'Esposizione, mi raccomando...! Milano e l’Esposizione internazionale del Sempione del 1906 nei documenti del Castello Sforzesco","G. Botti;CORDERA, PAOLA;RICCI, GIULIANA",2011,07.13 Progetti,-,nocluster
Uffici del Triennale Design Museum,"DE LUCCHI, MICHELE",2011,07.13 Progetti,-,nocluster
Filiali Superflash Intesa Sanpaolo,"DE LUCCHI, MICHELE",2011,07.13 Progetti,-,nocluster
Housing Contest - Bando europeo per la formazione di un Repertorio di progetti per edifici residenziali ad alte prestazioni e basso costo,"BELLINI, OSCAR EUGENIO;SCOCCIMARRO, ANTONIO;DAGLIO, LAURA;DALL'O', GIULIANO;SARTO, LUCA;SANNA, NICOLA;E. Pili;A. Morettini;S. Lugano;DLC s. r. l.;COLLINA, LUISA MARIA VIRGINIA;GEROSA, GIULIA MARIA;T. Belletti;P. Catena",2011,07.13 Progetti,-,nocluster
"Concorso nazionale per ""INTERVENTI DI RIQUALIFICAZIONE PAESAGGISTICO – AMBIENTALE ED ARCHITETTONICA DEL PIAZZALE SCOGLI ROSSI AD ARBATAX""","DAGLIO, LAURA;GEROSA, GIULIA MARIA;D. Fumagalli;G. Lassandro;A. Loi;LANZAROTTI, GRETA",2011,07.13 Progetti,-,nocluster
"Design Mediterraneo | Mediterranean Design, 2011","FERRARA, MARIA RITA;A. Calvera",2011,07.13 Progetti,Design; Mediterraneo; product design; visual design; fotografia; scenari futuri; sviluppo economico,nocluster
"Servizi alla visita dell'area archeologica di competenza SAR, Roma","DE LUCCHI, MICHELE",2011,07.13 Progetti,-,nocluster
"Design sul filo della tradizione. Strategie e strumenti di valorizzazione di competenze e culture locali 

Design on the thread of tradition. Strategies and instruments to exploit local skills and culture in the textile industry","VACCA, FEDERICA",2011,07.13 Progetti,design; craft; material culture; local know how; knowledge-based production; production of value,nocluster
Progetto dell'identità visiva per il centocinquantesimo anniversario del Politecnico di Milano.,"TOLINO, UMBERTO",2011,07.13 Progetti,Brand design; Corporate Identity; immagine coordinata per territorio e istituzioni culturali; politecnico di milano,nocluster
Green Connection,"VIGNATI, ARIANNA;MANZONI, ALBERTO;LOLLIO, VALENTINA;RIVIECCIO, VALENTINA;CARAMAGNO, MARINA",2012,07.03 Design,-,nocluster
La dinastia Brueghel,"GADDI, ROSSANA",2012,07.03 Design,-,nocluster
Brueghel. Meraviglie dell'arte fiamminga,"GADDI, ROSSANA",2012,07.03 Design,-,nocluster
ARPA DI LUCE,"MURANO, FRANCESCO;Gianpietro Grossi;Pietro Pirelli",2012,07.04 Performance,-,nocluster
ARPA DI LUCE ALLA NOTTE DEI RICERCATORI A MANTOVA,"MURANO, FRANCESCO;Gianpietro Grossi;Pietro Pirelli",2012,07.04 Performance,-,nocluster
Fabio Bortolani. My way,"MAFFEI, STEFANO",2012,07.06 Mostra,-,nocluster
"Censimento delle architetture Liberty nel territorio di Varese, Area nord, sentiero 10","ANZANI, ANNA;CONDOLEO, PAOLA;Baila A.;CARAMEL, CLAUDIA;GUARISCO, MARGHERITA",2012,07.06 Mostra,-,nocluster
LUCI SULLE MURA,"MURANO, FRANCESCO",2012,07.06 Mostra,-,nocluster
Analogico/Digitale,"MAFFEI, STEFANO;S. Micelli;BOLZAN, PATRIZIA;M. Pirovano;A. Gianni",2012,07.06 Mostra,-,nocluster
Magic Thinks,"MURANO, FRANCESCO;Fenoglio N.",2012,07.08 Prototipo d'arte e relativi progetti,MATERIALI FOTOLUMINESCENTI,nocluster
LASER PENDULUM,"MURANO, FRANCESCO;Gianpietro Grossi;Pietro Pirelli",2012,07.08 Prototipo d'arte e relativi progetti,-,nocluster
