-0;Esperti anonimi;-0;01.1 Articolo in Rivista;info:eu-repo/semantics/openAccess;-0;eng;-0;http://hdl.handle.net/11311/1019716;2014;01 CONTRIBUTO SU RIVISTA::01.1 Articolo in Rivista;-0;PAD;The Post-digital era: towards a relational and sustainable approach;ELETTRONICO;1;-0;LECCE, CHIARA;-0;
-0;Esperti anonimi;-0;01.1 Articolo in Rivista;info:eu-repo/semantics/openAccess;Abet Laminati;ita;-0;http://hdl.handle.net/11311/1019723;2014;01 CONTRIBUTO SU RIVISTA::01.1 Articolo in Rivista;-0;AIS / DESIGN;Abet Laminati: il design delle superfici;ELETTRONICO;1;-0;LECCE, CHIARA;-0;
-0;Comitato scientifico;-0;01.1 Articolo in Rivista;info:eu-repo/semantics/closedAccess;classicismo, ritorno alla figurazione, fortuna novecentesca di Piero della Francesca;ita;-0;http://hdl.handle.net/11311/1019724;2016;01 CONTRIBUTO SU RIVISTA::01.1 Articolo in Rivista;-0;ARTISTA;Glyn Philpot, e la Toscana;STAMPA;1;-0;MAZZANTI, ANNA;-0;
-0;Esperti anonimi;-0;01.1 Articolo in Rivista;info:eu-repo/semantics/openAccess;Fede Cheti;ita;-0;http://hdl.handle.net/11311/1019725;2013;01 CONTRIBUTO SU RIVISTA::01.1 Articolo in Rivista;-0;AIS / DESIGN;Fede Cheti: 1936-1975. Tracce di una storia italiana;ELETTRONICO;1;-0;LECCE, CHIARA;-0;
-0;Comitato scientifico;-0;01.1 Articolo in Rivista;info:eu-repo/semantics/openAccess;-0;eng;-0;http://hdl.handle.net/11311/1020040;2016;01 CONTRIBUTO SU RIVISTA::01.1 Articolo in Rivista;-0;STRATEGIC DESIGN RESEARCH JOURNAL;Activating new strategies for the Lombardy Region and the Italian-Swiss border area: A cultural design approach;ELETTRONICO;2;-0;"GUGLIELMETTI, ILARIA;TROCCHIANESI, RAFFAELLA";-0;
-0;Comitato scientifico;-0;01.1 Articolo in Rivista;info:eu-repo/semantics/closedAccess;-0;eng;-0;http://hdl.handle.net/11311/1020384;2015;01 CONTRIBUTO SU RIVISTA::01.1 Articolo in Rivista;-0;GSTF JOURNAL OF ENGINEERING TECHNOLOGY;Wayfinding Design and Accessibility. Experimental Research of new ways to approach the Landscape and Cultural Heritage for wider range of users;STAMPA;2;-0;"DE PAOLIS, ROBERTO;GUERINI, SILVIA";-0;
-0;Esperti anonimi;-0;01.1 Articolo in Rivista;info:eu-repo/semantics/openAccess;-0;eng;-0;http://hdl.handle.net/11311/1020703;2015;01 CONTRIBUTO SU RIVISTA::01.1 Articolo in Rivista;-0;JOURNAL OF CIVIL & ENVIRONMENTAL ENGINEERING;Analysis of Adaptive Traffic Control Systems Design of a Decision Support System for Better Choices;-0;3;-0;"STUDER, LUCA PASINO;KETABDARI, MISAGH;MARCHIONNI, GIOVANNA";-0;
-0;-0;-0;01.1 Articolo in Rivista;info:eu-repo/semantics/closedAccess;OMA, Koolhaas, Venezia, Fondaco dei Tedeschi;eng spa;;http://hdl.handle.net/11311/1008379;2016;01 CONTRIBUTO SU RIVISTA::01.1 Articolo in Rivista;-0;ARQUITECTURA VIVA;Comercio con la historia. OMA, Fondaco dei Tedeschi in Venice;STAMPA;1;-0;IRACE, FULVIO;-0;
-0;Comitato scientifico;-0;01.1 Articolo in Rivista;info:eu-repo/semantics/closedAccess;-0;eng ita;design della comunicazione, grafica, branding, narrazione, informazione digitale;http://hdl.handle.net/11311/1012519;2016;01 CONTRIBUTO SU RIVISTA::01.1 Articolo in Rivista;-0;DIID. DISEGNO INDUSTRIALE INDUSTRIAL DESIGN;Comunicare il viaggio: dalla guida al blog, dalla propaganda al branding;STAMPA;1;-0;GUIDA, FRANCESCO ERMANNO;-0;
-0;Esperti anonimi;-0;01.1 Articolo in Rivista;info:eu-repo/semantics/openAccess;-0;eng;materials experience;http://hdl.handle.net/11311/1013976;2017;01 CONTRIBUTO SU RIVISTA::01.1 Articolo in Rivista;-0;SUSTAINABILITY;Revived Beauty: Research into Aesthetic Appreciation of Materials to Valorise Materials from Waste;ELETTRONICO;3;-0;"Sauerwein, Marita;Karana, Elvin;ROGNOLI, VALENTINA";-0;
-0;Comitato scientifico;-0;01.1 Articolo in Rivista;info:eu-repo/semantics/openAccess;-0;eng ita;;http://hdl.handle.net/11311/1017614;2017;01 CONTRIBUTO SU RIVISTA::01.1 Articolo in Rivista;-0;FLASH ART;FLASH ART;STAMPA;1;-0;CAPPELLIERI, ALBA;-0;
-0;Comitato scientifico;-0;01.1 Articolo in Rivista;info:eu-repo/semantics/openAccess;-0;eng ita;DESIGN FOR CHILDREN, triennale di milano, alba cappellieri, politecnico di milano, italian design,;http://hdl.handle.net/11311/1017621;2017;01 CONTRIBUTO SU RIVISTA::01.1 Articolo in Rivista;-0;IL GIORNALE DELL'ARCHITETTURA;DESIGN FOR CHILDREN;ELETTRONICO;1;-0;CAPPELLIERI, ALBA;-0;
-0;-0;-0;01.1 Articolo in Rivista;info:eu-repo/semantics/openAccess;CMF design, materiali, design primario, Trini Castelli;eng ita;;http://hdl.handle.net/11311/1017974;2016;01 CONTRIBUTO SU RIVISTA::01.1 Articolo in Rivista;-0;ABITARE;Clino Trini Castelli, La pratica della lungimiranza - The Practice of Foresight;STAMPA;1;-0;BOSONI, GIAMPIERO;-0;
-0;-0;-0;01.1 Articolo in Rivista;info:eu-repo/semantics/openAccess;-0;eng ita;;http://hdl.handle.net/11311/1017976;2016;01 CONTRIBUTO SU RIVISTA::01.1 Articolo in Rivista;-0;DOMUS;Le mutazioni del contract - The Changing Contract Sector;STAMPA;1;-0;BOSONI, GIAMPIERO;-0;
-0;-0;-0;01.1 Articolo in Rivista;info:eu-repo/semantics/openAccess;-0;eng jpn;;http://hdl.handle.net/11311/1017978;2016;01 CONTRIBUTO SU RIVISTA::01.1 Articolo in Rivista;-0;APPROACH;Aoi's Planned Hope;STAMPA;1;-0;BOSONI, GIAMPIERO;-0;
-0;-0;-0;01.1 Articolo in Rivista;info:eu-repo/semantics/openAccess;-0;eng ita;;http://hdl.handle.net/11311/1018137;2016;01 CONTRIBUTO SU RIVISTA::01.1 Articolo in Rivista;-0;CARTADITALIA;"L'âge d'or dei ""maestri"" del design italiano, The âge d'or of the ""masters"" of italian design, L'âge d'or des ""maîtres"" du design italien, De 'gouden eeuw' van de 'meesters' van het Italliaanse design";STAMPA;1;-0;BOSONI, GIAMPIERO;-0;
-0;Comitato scientifico;-0;01.1 Articolo in Rivista;info:eu-repo/semantics/closedAccess;-0;eng ita;;http://hdl.handle.net/11311/1018547;2016;01 CONTRIBUTO SU RIVISTA::01.1 Articolo in Rivista;-0;LUCE;GENIUS LUCI - Il primo museo di illuminazione urbana all’EUR di Roma;STAMPA;3;-0;"D'Alesio, Carlo;GENTILI, HELENA;CASCIANI, DARIA";-0;
-0;-0;-0;01.1 Articolo in Rivista;info:eu-repo/semantics/closedAccess;-0;eng ita;Hotel, interior design, contract design, ospitalità;http://hdl.handle.net/11311/1019070;2016;01 CONTRIBUTO SU RIVISTA::01.1 Articolo in Rivista;-0;DOMUS;Design dell'Ospitalità;STAMPA;2;-0;"SCULLICA, FRANCESCO;Elgani, E.";-0;
-0;-0;-0;01.1 Articolo in Rivista;info:eu-repo/semantics/closedAccess;-0;eng ita;;http://hdl.handle.net/11311/1019077;2016;01 CONTRIBUTO SU RIVISTA::01.1 Articolo in Rivista;-0;DESIGN DIFFUSION NEWS;Neri&HU Projects;STAMPA;2;-0;"SCULLICA, FRANCESCO;Elgani, E.";-0;
-0;Esperti anonimi;-0;01.1 Articolo in Rivista;info:eu-repo/semantics/closedAccess;-0;eng;urban interior design;http://hdl.handle.net/11311/1019130;2016;01 CONTRIBUTO SU RIVISTA::01.1 Articolo in Rivista;-0;IDEA;Reloading Spaces: How design makes urban spaces more liveable;STAMPA;3;-0;"CAMOCINI, BARBARA;PETRILLO, DANIELA;REBAGLIO, AGNESE";-0;
-0;Comitato scientifico;-0;01.1 Articolo in Rivista;info:eu-repo/semantics/openAccess;-0;eng chi;;http://hdl.handle.net/11311/1019647;2016;01 CONTRIBUTO SU RIVISTA::01.1 Articolo in Rivista;-0;ZHUANGSHI;Living interiors in the digital age: the Smart Home;STAMPA;1;-0;LECCE, CHIARA;-0;
-0;Comitato scientifico;-0;01.1 Articolo in Rivista;info:eu-repo/semantics/openAccess;Uffici;eng ita;;http://hdl.handle.net/11311/1019648;2016;01 CONTRIBUTO SU RIVISTA::01.1 Articolo in Rivista;-0;DOMUS;Ufficio: una lunga evoluzione/The Office: a long evolution;STAMPA;1;-0;LECCE, CHIARA;-0;
