dc.type.full,dc.identifier.uri,dc.date.issued,dc.title,dc.authority.people
05 BREVETTO::05.1 Brevetto,http://hdl.handle.net/11311/1045208,1989,SERVIZIO PER PRANZO IN PIEDI,MARIO BISSON;PAOLO DE LUCCHI;GHOLAM KOWSAR
05 BREVETTO::05.1 Brevetto,http://hdl.handle.net/11311/242582,2001,struttura di spazzolino da denti,"L. Bazzicalupo;MANGIAROTTI, RAFFAELLA"
05 BREVETTO::05.1 Brevetto,http://hdl.handle.net/11311/532965,2001,Sistema di Parete Attrezzata e cablata con Tecnologie EIB,"BRUNO, DAVIDE MARIA"
05 BREVETTO::05.1 Brevetto,http://hdl.handle.net/11311/242585,2002,"Dispositivo portatile per refrigerare alimenti, particolarmente per alimenti contenuti  in un contenitore almeno in parte flessibile","R. Gatti;INGARAMO, MATTEO ORESTE"
05 BREVETTO::05.1 Brevetto,http://hdl.handle.net/11311/251326,2002,"Dispositivo di conservazione di alimenti a parete, in particolare per frutta","R. Gatti;INGARAMO, MATTEO ORESTE"
05 BREVETTO::05.1 Brevetto,http://hdl.handle.net/11311/258077,2002,Terminale wireless contenuto in un involucro morbido,"MANGIAROTTI, RAFFAELLA;TRABUCCO, FRANCESCO"
05 BREVETTO::05.1 Brevetto,http://hdl.handle.net/11311/643329,2003,Contenitore termicamente isolato particolarmente isolato per bevande e simili,"MANGIAROTTI, RAFFAELLA;BAZZICALUPO, LEOPOLDO MATTEO"
05 BREVETTO::05.1 Brevetto,http://hdl.handle.net/11311/252095,2004,Asciugacapelli con caratteristiche ergonomiche migliorate,"MANGIAROTTI, RAFFAELLA"
05 BREVETTO::05.1 Brevetto,http://hdl.handle.net/11311/246657,2006,Dispositivo asciugacapelli,"L. Bazzicalupo;MANGIAROTTI, RAFFAELLA"
05 BREVETTO::05.1 Brevetto,http://hdl.handle.net/11311/257743,2006,Prodotto realizzato dal riutilizzo di sfridi di produzione,"BERTOLA, PAOLA;D. Leoni"
05 BREVETTO::05.1 Brevetto,http://hdl.handle.net/11311/579141,2006,SISTEMA DI PUNTAMENTO DELLE SORGENTI LUMINOSE IN APPARECCHI DI ILLUMINAZIONE,"MURANO, FRANCESCO"
05 BREVETTO::05.1 Brevetto,http://hdl.handle.net/11311/579142,2006,SISTEMA DI TRASPORTO DI ENERGIA ELETTRICA A BASSO VOLTAGGIO IN PARTICOLARE PER L'ALIMENTAZIONE DI PIANI DI APPOGGIO MUNITI DI SORGENTE,"MURANO, FRANCESCO"
05 BREVETTO::05.1 Brevetto,http://hdl.handle.net/11311/643330,2007,hairdrier device,"MANGIAROTTI, RAFFAELLA;BAZZICALUPO, LEOPOLDO MATTEO"
05 BREVETTO::05.1 Brevetto,http://hdl.handle.net/11311/693688,2007,Chair Strcture,"M. De Bonis;ROMERO, MAXIMILIANO ERNESTO;COSTA, FIAMMETTA CARLA ENRICA;G. Gualandi"
05 BREVETTO::05.1 Brevetto,http://hdl.handle.net/11311/545462,2008,Dispositivo di cottura,"D. Bongini;CANINA, MARIA RITA;FERRARO, VENERE;L. Melotti;S. Palmeto"
05 BREVETTO::05.1 Brevetto,http://hdl.handle.net/11311/643332,2008,Dispositivo audioluminoso per esterni,"MANGIAROTTI, RAFFAELLA;BAZZICALUPO, LEOPOLDO MATTEO;charon srl"
05 BREVETTO::05.1 Brevetto,http://hdl.handle.net/11311/533023,2009,Sistema per il varo e l'alaggio di imbarcazioni,"RATTI, ANDREA;FUMAGALLI G."
05 BREVETTO::05.1 Brevetto,http://hdl.handle.net/11311/564171,2009,Dispositivo aspiratore/erogatore per un liquido,"G. Bortoluzzi;ANSELMI, LAURA;A. Grasselli"
05 BREVETTO::05.1 Brevetto,http://hdl.handle.net/11311/566421,2009,KNOT RING,"CAPPELLIERI, ALBA"
05 BREVETTO::05.1 Brevetto,http://hdl.handle.net/11311/575806,2010,Dispositivo di riabilitazione,"CANINA, MARIA RITA;S. Lang"
05 BREVETTO::05.1 Brevetto,http://hdl.handle.net/11311/582632,2010,Apparecchio per la riabilitazione,"CANINA, MARIA RITA;S. Lang"
05 BREVETTO::05.1 Brevetto,http://hdl.handle.net/11311/582634,2010,Apparecchio per la riabilitazione,"CANINA, MARIA RITA;S. Lang"
05 BREVETTO::05.1 Brevetto,http://hdl.handle.net/11311/582636,2010,Apparecchio per la riabilitazione,"CANINA, MARIA RITA;S. Lang"
05 BREVETTO::05.1 Brevetto,http://hdl.handle.net/11311/776927,2010,Capo di vestiario di tipo BSI per il rilevamento di parametri vitali di un neonato,"ANDREONI, GIUSEPPE;L. Moltani;R. Zanini;R. Bellù"
05 BREVETTO::05.1 Brevetto,http://hdl.handle.net/11311/547230,2011,Zip fastener slider including an electronic anti-counterfeiting device situated inside the slider and/or the relative puller,"MANGIAROTTI, RAFFAELLA;S. Dotti"
05 BREVETTO::05.1 Brevetto,http://hdl.handle.net/11311/622773,2011,Contenitore per pizze,"Andrea Rizzardi;FERRARO, VENERE"
05 BREVETTO::05.1 Brevetto,http://hdl.handle.net/11311/664562,2011,O'Hand,"CANINA, MARIA RITA;S. Lang"
05 BREVETTO::05.1 Brevetto,http://hdl.handle.net/11311/689990,2011,WHS ITEM OF CLOTHING FOR DETECTION OF VITAL PARAMETERS OF A BABY,"ANDREONI, GIUSEPPE;L. A. L. Moltani;R. Zanini;R. C. Bellu'"
05 BREVETTO::05.1 Brevetto,http://hdl.handle.net/11311/703133,2011,Dispositivo di seduta e relativa sella,"BRUNO, DAVIDE MARIA;ANDREONI, GIUSEPPE"
05 BREVETTO::05.1 Brevetto,http://hdl.handle.net/11311/643731,2012,PARETE MOBILE E SISTEMA CON FUNZIONI DI OTTIMIZZAZIONE DI CONDIZIONI AMBIENTALI,"BRUNO, DAVIDE MARIA"
05 BREVETTO::05.1 Brevetto,http://hdl.handle.net/11311/643732,2012,Movable wall and system with environmental condition optimisation functions,"BRUNO, DAVIDE MARIA;Merra, M.;Paracchini, L.;FUSAR POLI, E.;Giola, F.;Cambiaghi, A."
05 BREVETTO::05.1 Brevetto,http://hdl.handle.net/11311/687790,2012,APPARATO PORTATILE PER COTTURA ALLA GRIGLIA,"ANSELMI, LAURA;M. Buffoli;A. Grasselli"
05 BREVETTO::05.1 Brevetto,http://hdl.handle.net/11311/688626,2012,Dispositivo portatile di allenamento fisico e kit comprendente tale dispositivo,"ANSELMI, LAURA;A. Grasselli;A. Anedda"
05 BREVETTO::05.1 Brevetto,http://hdl.handle.net/11311/688635,2012,Dispositivo portatile di allenamento fisico e kit comprendente tale dispositivo,"ANSELMI, LAURA;A. Grasselli;A. Anedda"
05 BREVETTO::05.1 Brevetto,http://hdl.handle.net/11311/918155,2013,Coperta inventa storie,"Valentina Nuccio;CELI, MANUELA"
05 BREVETTO::05.1 Brevetto,http://hdl.handle.net/11311/1041805,2014,Sistema indossabile per il monitoraggio delle performance del nuotatore,"G. Andreoni;MOLTANI, LARA ALESSIA LAURA;P. Perego;LAVEZZARI, RICCARDO"
05 BREVETTO::05.1 Brevetto,http://hdl.handle.net/11311/1038529,2015,WEARABLE SYSTEM FOR MONITORING A SWIMMER'S PERFORMANCE,ANDREONI GIUSEPPE;LAVEZZARI RICCARDO;PEREGO PAOLO;MOLTANI LARA ALESSIA LAURA
05 BREVETTO::05.1 Brevetto,http://hdl.handle.net/11311/930358,2015,Sistema ambientale per la terapia del treno,"BIAMONTI, ALESSANDRO;I. Cilesi;L. Lani"
05 BREVETTO::05.1 Brevetto,http://hdl.handle.net/11311/930361,2015,Cabina Terapeutica,"BIAMONTI, ALESSANDRO;GRAMEGNA, SILVIA MARIA"
05 BREVETTO::05.1 Brevetto,http://hdl.handle.net/11311/969233,2015,Giunto ad incastro con sfere,"Posada, Miguel Melo;FERRARO, VENERE"
05 BREVETTO::05.1 Brevetto,http://hdl.handle.net/11311/974606,2015,Set da costruzione per bambini,"Melo Posada, Miguel;FERRARO, VENERE"
05 BREVETTO::05.1 Brevetto,http://hdl.handle.net/11311/1002912,2016,ICE BLOCK GLASS,"MURANO, FRANCESCO"
05 BREVETTO::05.1 Brevetto,http://hdl.handle.net/11311/1006914,2016,Dispositivo educativo interattivo,"Sonia, China;FERRARO, VENERE;Belen, Corradi;Marius, Holter;Kasper, Pietrzykowski"
05 BREVETTO::05.1 Brevetto,http://hdl.handle.net/11311/1007045,2016,GIOCO TATTILE PER NON VEDENTI,"FERRARO, VENERE;Lorenzo Sarghini"
05 BREVETTO::05.1 Brevetto,http://hdl.handle.net/11311/1011853,2017,Dispositivo di navigazione indossabile da una persona,"CHE ME, ROSALAM;BIAMONTI, ALESSANDRO;FERRARO, VENERE;Stepanovic, M."
05 BREVETTO::05.1 Brevetto,http://hdl.handle.net/11311/1026966,2017,Metodo e dispositivo indossabile per il controllo di inquinanti gassosi,"FERRARO, VENERE"
05 BREVETTO::05.1 Brevetto,http://hdl.handle.net/11311/1028484,2017,"SISTEMA PLURISENSORIALE ADATTATO PER LA PREVENZIONE DI MALATTIE PROFESSIONALI NELL’AMBIENTE
DI LAVORO, E METODO PER L’USO DEL SISTEMA","JANSEN, KASPAR;MOLTANI, ALESSIA;STEPANOVIC, MILA;FERRARO, VENERE;FERRARIS, SILVIA DEBORAH;ANDREONI, GIUSEPPE;CAPPELLIERI, ALBA"
05 BREVETTO::05.1 Brevetto,http://hdl.handle.net/11311/1031972,2017,MUtable. Interactive Children’s table,"TOLINO, UMBERTO;Venturelli, Luca"
05 BREVETTO::05.1 Brevetto,http://hdl.handle.net/11311/1045202,2017,Culla per neonati,"BELTRAMI, BENEDETTA;BISSON Mario;ANDREIS Diego;BARNI, GRETA"
05 BREVETTO::05.1 Brevetto,http://hdl.handle.net/11311/1052998,2017,Apparato e metodo per illuminare oggetti,F. MURANO;M. CELI
05 BREVETTO::05.1 Brevetto,http://hdl.handle.net/11311/1056092,2017,APPARECCHIATURA MISCELATRICE E DOSATRICE DI PRODOTTI DETERGENTI,"GENNA, CRISTINA;Palmieri, Stefania;ANDREIS, DIEGO VITTORIO;Barni, Greta"
05 BREVETTO::05.1 Brevetto,http://hdl.handle.net/11311/1059394,2018,"PLURISENSORIAL SYSTEM ADAPTED FOR THE PREVENTION OF PROFESSIONAL DISEASES IN THE WORKING ENVIRONMENT, AND METHOD FOR THE USE OF THE SYSTEM”",Venere Ferraro;Giuseppe Andreoni;Alba Cappellieri;Silvia Ferraris;Kaspar Jansen;Alessia Moltani;Mila Stepanovic
05 BREVETTO::05.1 Brevetto,http://hdl.handle.net/11311/1059395,2018,WEARABLE DEVICE FOR CONTROLLING GASEOUS POLLUTANTS,Venere Ferraro;Mila Stepanovic
